{"$schema":"https://json-schema.org/draft/2020-12/schema","title":"Project Supernova Benchmark Registry v1.2","type":"object","additionalProperties":false,"required":["schema_version","authority","pool_disposition_path","pool_reuse_rule","programs","terminal_task_statuses","suite_completion_rule","advancement_rule","registry_exhaustion_rule"],"properties":{"schema_version":{"type":"string"},"authority":{"const":"EXTERNAL_BENCHMARK_ORCHESTRATION_ONLY"},"pool_disposition_path":{"const":"benchmark/pool_disposition.json"},"pool_reuse_rule":{"type":"string"},"programs":{"type":"object","additionalProperties":false,"required":["MASTERMIND","MATH_FOUNDRY"],"properties":{"MASTERMIND":{"$ref":"#/$defs/program"},"MATH_FOUNDRY":{"$ref":"#/$defs/program"}}},"terminal_task_statuses":{"type":"array","items":{"type":"string"}},"suite_completion_rule":{"type":"string"},"advancement_rule":{"type":"string"},"registry_exhaustion_rule":{"type":"string"}},"$defs":{"program":{"type":"object","additionalProperties":false,"required":["active_suite_id","active_suite_state","suites"],"properties":{"active_suite_id":{"type":"string"},"active_suite_state":{"type":"string"},"suites":{"type":"array","items":{"type":"object","additionalProperties":true,"required":["suite_id","kind","status","public_name","evidence_pool","successor"],"properties":{"suite_id":{"type":"string"},"kind":{"type":"string"},"status":{"type":"string"},"public_name":{"type":"string"},"evidence_pool":{"enum":["TRAIN_TUNING","CALIBRATION","G1_PROSPECTIVE","G8_CASCADE","GOAL2_E5B","RESEARCH_FROZEN"]},"successor":{"type":["string","null"]}}}}}}}}
