{
  "schema_version":"1.2",
  "authority":"EXTERNAL_BENCHMARK_ORCHESTRATION_ONLY",
  "pool_disposition_path":"benchmark/pool_disposition.json",
  "pool_reuse_rule":"TRAIN_TUNING or CALIBRATION evidence can never later be relabeled G1_PROSPECTIVE, G8_CASCADE or GOAL2_E5B promotion evidence.",
  "programs":{
    "MASTERMIND":{"active_suite_id":"MM-ORACLE-PHASE1-REACT","active_suite_state":"EXTERNAL_SEALED_EXECUTION","suites":[
      {"suite_id":"MM-ORACLE-PHASE1-REACT","kind":"CLEAN_PROSPECTIVE_ORACLE_MATRIX","status":"ACTIVE_EXTERNAL","public_name":"ReactBench Phase-1 Oracle Matrix","evidence_pool":"CALIBRATION","protected_payload":"PRIVATE_OR_EXTERNAL_SESSION_ONLY","completion_requires":["all frozen tasks terminal","all planned repeats terminal","evaluator/oracle identities frozen","no unresolved contamination","independent completion receipt"],"successor":"MM-DESIGN2CODE-HARD-STATEFUL"},
      {"suite_id":"MM-DESIGN2CODE-HARD-STATEFUL","kind":"UI_CODE_GENERALIZATION","status":"PLANNED_PREFLIGHT_REQUIRED","public_name":"Design2Code-HARD + stateful UI","evidence_pool":"TRAIN_TUNING","successor":"MM-DESIGNBENCH-WEBPAI"},
      {"suite_id":"MM-DESIGNBENCH-WEBPAI","kind":"UI_DESIGN_GENERALIZATION","status":"PLANNED_PREFLIGHT_REQUIRED","public_name":"DesignBench / WebPAI","evidence_pool":"TRAIN_TUNING","successor":"MM-DEEPSWE"},
      {"suite_id":"MM-DEEPSWE","kind":"SOFTWARE_AGENT_GENERALIZATION","status":"PLANNED_PREFLIGHT_REQUIRED","public_name":"DeepSWE lane","evidence_pool":"TRAIN_TUNING","successor":"MM-SLOPCODE"},
      {"suite_id":"MM-SLOPCODE","kind":"SOFTWARE_QUALITY_CONTRACTS","status":"PLANNED_PREFLIGHT_REQUIRED","public_name":"SlopCodeBench","evidence_pool":"TRAIN_TUNING","successor":"MM-SENIOR-SWE"},
      {"suite_id":"MM-SENIOR-SWE","kind":"ARCHITECTURE_AND_REPO_SCALE","status":"PLANNED_PREFLIGHT_REQUIRED","public_name":"Senior SWE-Bench","evidence_pool":"TRAIN_TUNING","successor":"MM-WEBCOMPASS-HARD"},
      {"suite_id":"MM-WEBCOMPASS-HARD","kind":"WEB_AGENT_GENERALIZATION","status":"PLANNED_PREFLIGHT_REQUIRED","public_name":"WebCompass Hard","evidence_pool":"TRAIN_TUNING","successor":"MM-LIVEEVAL-L3"},
      {"suite_id":"MM-LIVEEVAL-L3","kind":"LIVE_GENERALIZATION","status":"PLANNED_PREFLIGHT_REQUIRED","public_name":"LiveEvalBench L3","evidence_pool":"TRAIN_TUNING","successor":"MM-MINEBENCH"},
      {"suite_id":"MM-MINEBENCH","kind":"LONG_HORIZON_AGENT","status":"PLANNED_PREFLIGHT_REQUIRED","public_name":"MineBench.ai","evidence_pool":"TRAIN_TUNING","successor":"MM-SWE-REVIEW"},
      {"suite_id":"MM-SWE-REVIEW","kind":"REVIEW_AND_CRITIQUE","status":"PLANNED_PREFLIGHT_REQUIRED","public_name":"SWE-Review","evidence_pool":"TRAIN_TUNING","successor":null}
    ]},
    "MATH_FOUNDRY":{"active_suite_id":"MF-E1-CLEAN-ROUTE-TRUTH","active_suite_state":"NEXT_REQUIRES_PRIVATE_FREEZE_AFTER_TRANSPORT_CALIBRATION","suites":[
      {"suite_id":"MF-DEV-QUALIFICATION","kind":"REGRESSION_AND_EXECUTION_CLOSURE","status":"TERMINAL_DEVELOPMENT_ONLY","public_name":"v3.0.1 internal qualification / known development regressions","evidence_pool":"TRAIN_TUNING","promotion_evidence":false,"successor":"MF-E1-CLEAN-ROUTE-TRUTH"},
      {"suite_id":"MF-E1-CLEAN-ROUTE-TRUTH","kind":"CLEAN_MULTI_DOMAIN_ROUTE_SCHEDULE_MATRIX","status":"ACTIVE_NEXT_AFTER_TRANSPORT","public_name":"E1 clean route/schedule truth","evidence_pool":"CALIBRATION","completion_requires":["frozen hidden multi-domain task matrix","BASE/SBS/single-route-VBS/AUTO measured","same-total-budget ORACLE_SCHEDULE measured when admissible","all route work/cost/availability recorded","independent exact verification"],"successor":"MF-G1-CLEAN-PROSPECTIVE"},
      {"suite_id":"MF-G1-CLEAN-PROSPECTIVE","kind":"ONE_GENERATION_PROSPECTIVE_CAPABILITY","status":"BLOCKED_BY_E1","public_name":"G1 fresh prospective capability gain","evidence_pool":"G1_PROSPECTIVE","successor":"MF-C1-PRODUCT-CLOSURE"},
      {"suite_id":"MF-C1-PRODUCT-CLOSURE","kind":"VERIFIED_PRODUCT_REUSE_CONTROL","status":"BLOCKED_UNTIL_JUSTIFIED","public_name":"C1 generic verified-product closure + same-products control","evidence_pool":"CALIBRATION","successor":"MF-E3-MECHANISM-CONTROL"},
      {"suite_id":"MF-E3-MECHANISM-CONTROL","kind":"LEARNED_RANDOM_NOCHANGE_CONTROL","status":"BLOCKED_UNTIL_EXECUTABLE_CANDIDATE","public_name":"E3 learned/random/no-change","evidence_pool":"CALIBRATION","successor":"MF-C2-TRANSFER"},
      {"suite_id":"MF-C2-TRANSFER","kind":"BOUNDED_OPERATOR_TRANSFER","status":"BLOCKED_BY_E3","public_name":"C2 unrelated transfer / CrossingEvent","evidence_pool":"CALIBRATION","successor":"MF-SELECTOR-VOC-CONTROL"},
      {"suite_id":"MF-SELECTOR-VOC-CONTROL","kind":"ENABLEMENT_AWARE_SELECTOR_AND_VALUE_OF_COMPUTATION","status":"BLOCKED_BY_CAUSAL_ENABLEMENT_AND_COMPONENT_GATES","public_name":"Selector / value-of-computation controls","evidence_pool":"CALIBRATION","completion_requires":["current Foundry baseline","frequency/reuse baseline","static typed heuristic","random admissible baseline","matched VBS_schedule/portfolio reference","complete selection overhead"],"successor":"MF-G8-FINITE-SUPERNOVA"},
      {"suite_id":"MF-G8-FINITE-SUPERNOVA","kind":"FINITE_FRESH_SUPERNOVA_CASCADE","status":"BLOCKED_BY_T0_G1_C1_RXN_E3_SELECTOR","public_name":"Goal-1 finite Supernova cascade","evidence_pool":"G8_CASCADE","completion_requires":["fresh disjoint G8 pool","same-products static control","closure-off control where coherent","ordinary/current Foundry","static selector","random admissible selector","VBS_schedule/matched portfolio","equal complete cost","independent root verification and statement fidelity","predeclared depth/stopping/statistics"],"successor":"MF-E5B-IMPROVER"},
      {"suite_id":"MF-E5-MULTIGEN","kind":"MULTI_GENERATION_VERIFIED_IMPROVEMENT","status":"OPTIONAL_AFTER_GOAL1_DEVELOPMENT_ONLY","public_name":"Optional multi-generation solver development","evidence_pool":"TRAIN_TUNING","promotion_evidence":false,"successor":null},
      {"suite_id":"MF-E5B-IMPROVER","kind":"IMPROVER_OF_IMPROVER","status":"FUTURE_AFTER_GOAL1","public_name":"E5B improver-of-improver","evidence_pool":"GOAL2_E5B","completion_requires":["Goal1 G8 prospectively validated","same untouched F*","same information cutoff","same model/tools/sandbox","same evaluator/referee","same complete R&D budget","2x2 memory/policy carry-over control","fresh disjoint Goal2 pool"],"successor":"MF-E6-INDEPENDENT"},
      {"suite_id":"MF-E6-INDEPENDENT","kind":"INDEPENDENT_CAPABILITY_ADMISSION","status":"FUTURE","public_name":"E6 independent capability admission","evidence_pool":"RESEARCH_FROZEN","successor":null}
    ]}
  },
  "terminal_task_statuses":["PASS","FAIL","NOT_MEASURED_WITH_REASON","QUARANTINED","INVALID","ABSTAINED"],
  "suite_completion_rule":"A suite is terminal only when every frozen task/arm/repeat has exactly one terminal status, all evaluator/checker receipts are present, all costs are closed, and contamination/adjudication holds are resolved. Terminal does not mean successful.",
  "advancement_rule":"Program lanes advance independently. BIL00 may advance a program only after a verified immutable benchmark completion receipt, compatible Stage -1 pool disposition, successor eligibility/preflight and required private freeze. It must never infer completion from elapsed time or task count.",
  "registry_exhaustion_rule":"If successor=null or successor is ineligible/unavailable, enter BENCHMARK_DISCOVERY_WAIT. No fresh evidence is consumed. BIL00 research may propose candidates, but registry admission requires preflight, pool disposition and private pre-outcome freeze."
}
